{
  "status": "IMPLEMENTED_NOT_DEPLOYED",
  "matrix_id": "DUCA-UNIFIED-FULLMATRIX-v001-20260902",
  "integration_base": "95ca6eb4a7e0ba8259c5afd976cc30d0fea58865",
  "branch": "codex/duca-unified-fullmatrix-20260902",
  "final_commit": "90b81a6b09388b11e67c9d62a070a9285b4cc3b7",
  "matrix_counts": {
    "development": 17,
    "confirmation": 24,
    "total_train_eval": 41
  },
  "modified_files": [
    "configs/adatad/thumos/duca_unified_fullmatrix/duca_unified_confirmation_a10_seed4407.py",
    "configs/adatad/thumos/duca_unified_fullmatrix/duca_unified_confirmation_a10_seed5407.py",
    "configs/adatad/thumos/duca_unified_fullmatrix/duca_unified_confirmation_a10_seed6407.py",
    "configs/adatad/thumos/duca_unified_fullmatrix/duca_unified_confirmation_a11_seed4407.py",
    "configs/adatad/thumos/duca_unified_fullmatrix/duca_unified_confirmation_a11_seed5407.py",
    "configs/adatad/thumos/duca_unified_fullmatrix/duca_unified_confirmation_a11_seed6407.py",
    "configs/adatad/thumos/duca_unified_fullmatrix/duca_unified_confirmation_c11_seed4407.py",
    "configs/adatad/thumos/duca_unified_fullmatrix/duca_unified_confirmation_c11_seed5407.py",
    "configs/adatad/thumos/duca_unified_fullmatrix/duca_unified_confirmation_c11_seed6407.py",
    "configs/adatad/thumos/duca_unified_fullmatrix/duca_unified_confirmation_d1_seed4407.py",
    "configs/adatad/thumos/duca_unified_fullmatrix/duca_unified_confirmation_d1_seed5407.py",
    "configs/adatad/thumos/duca_unified_fullmatrix/duca_unified_confirmation_d1_seed6407.py",
    "configs/adatad/thumos/duca_unified_fullmatrix/duca_unified_confirmation_e01_seed4407.py",
    "configs/adatad/thumos/duca_unified_fullmatrix/duca_unified_confirmation_e01_seed5407.py",
    "configs/adatad/thumos/duca_unified_fullmatrix/duca_unified_confirmation_e01_seed6407.py",
    "configs/adatad/thumos/duca_unified_fullmatrix/duca_unified_confirmation_f11_seed4407.py",
    "configs/adatad/thumos/duca_unified_fullmatrix/duca_unified_confirmation_f11_seed5407.py",
    "configs/adatad/thumos/duca_unified_fullmatrix/duca_unified_confirmation_f11_seed6407.py",
    "configs/adatad/thumos/duca_unified_fullmatrix/duca_unified_confirmation_h0_seed4407.py",
    "configs/adatad/thumos/duca_unified_fullmatrix/duca_unified_confirmation_h0_seed5407.py",
    "configs/adatad/thumos/duca_unified_fullmatrix/duca_unified_confirmation_h0_seed6407.py",
    "configs/adatad/thumos/duca_unified_fullmatrix/duca_unified_confirmation_u0_seed4407.py",
    "configs/adatad/thumos/duca_unified_fullmatrix/duca_unified_confirmation_u0_seed5407.py",
    "configs/adatad/thumos/duca_unified_fullmatrix/duca_unified_confirmation_u0_seed6407.py",
    "configs/adatad/thumos/duca_unified_fullmatrix/duca_unified_development_a00_seed3407.py",
    "configs/adatad/thumos/duca_unified_fullmatrix/duca_unified_development_a01_seed3407.py",
    "configs/adatad/thumos/duca_unified_fullmatrix/duca_unified_development_a10_seed3407.py",
    "configs/adatad/thumos/duca_unified_fullmatrix/duca_unified_development_a11_seed3407.py",
    "configs/adatad/thumos/duca_unified_fullmatrix/duca_unified_development_b00_seed3407.py",
    "configs/adatad/thumos/duca_unified_fullmatrix/duca_unified_development_b10_seed3407.py",
    "configs/adatad/thumos/duca_unified_fullmatrix/duca_unified_development_b11_seed3407.py",
    "configs/adatad/thumos/duca_unified_fullmatrix/duca_unified_development_c01_seed3407.py",
    "configs/adatad/thumos/duca_unified_fullmatrix/duca_unified_development_c11_seed3407.py",
    "configs/adatad/thumos/duca_unified_fullmatrix/duca_unified_development_d1_seed3407.py",
    "configs/adatad/thumos/duca_unified_fullmatrix/duca_unified_development_e01_seed3407.py",
    "configs/adatad/thumos/duca_unified_fullmatrix/duca_unified_development_e11_seed3407.py",
    "configs/adatad/thumos/duca_unified_fullmatrix/duca_unified_development_f11_seed3407.py",
    "configs/adatad/thumos/duca_unified_fullmatrix/duca_unified_development_g10_seed3407.py",
    "configs/adatad/thumos/duca_unified_fullmatrix/duca_unified_development_g11_seed3407.py",
    "configs/adatad/thumos/duca_unified_fullmatrix/duca_unified_development_h0_seed3407.py",
    "configs/adatad/thumos/duca_unified_fullmatrix/duca_unified_development_u0_seed3407.py",
    "docs/experiments/DUCA_UNIFIED_FULLMATRIX_FREEZE.md",
    "docs/experiments/DUCA_UNIFIED_FULLMATRIX_README.md",
    "docs/experiments/DUCA_UNIFIED_FULLMATRIX_SHA256SUMS",
    "docs/experiments/DUCA_UNIFIED_FULL_MATRIX_AGENT_COMMAND.md",
    "docs/experiments/agent_output_schema.json",
    "docs/experiments/duca_unified_matrix_manifest.yaml",
    "opentad/cores/train_engine.py",
    "opentad/models/backbones/backbone_wrapper.py",
    "opentad/models/backbones/vit_adapter.py",
    "opentad/models/bricks/scale_adaptive_conv1d.py",
    "opentad/models/detectors/actionformer.py",
    "opentad/models/detectors/single_stage.py",
    "opentad/models/duca/__init__.py",
    "opentad/models/duca/acquisition.py",
    "opentad/models/duca/feature_attribution.py",
    "opentad/models/duca/phase_fields.py",
    "opentad/models/selectors/duca_online_frame_selector.py",
    "scripts/duca_unified_fullmatrix/audit_afterany.sbatch",
    "scripts/duca_unified_fullmatrix/bootstrap_array.sbatch",
    "scripts/duca_unified_fullmatrix/cost_array.sbatch",
    "scripts/duca_unified_fullmatrix/finalize.sbatch",
    "scripts/duca_unified_fullmatrix/matrix.json",
    "scripts/duca_unified_fullmatrix/matrix.tsv",
    "scripts/duca_unified_fullmatrix/preflight.sbatch",
    "scripts/duca_unified_fullmatrix/submit_all.sh",
    "scripts/duca_unified_fullmatrix/train_eval_array.sbatch",
    "tests/test_duca_unified_attribution.py",
    "tests/test_duca_unified_curriculum.py",
    "tests/test_duca_unified_mod.py",
    "tests/test_duca_unified_phase.py",
    "tests/test_duca_unified_physical_time.py",
    "tools/bata/aggregate_duca_unified_fullmatrix.py",
    "tools/bata/bootstrap_duca_unified_fullmatrix.py",
    "tools/bata/generate_duca_unified_fullmatrix.py"
  ],
  "tests": {
    "status": "PASS_LOCAL_WITH_ENV_NOTE",
    "summary": "Attachment SHA256 verification passed. Matrix generation check passed. py_compile passed for edited training/model/tool files and all generated configs. New DUCA unified tests passed under conda env open_mmlab: 17 passed. Required repository checks passed under conda env open_mmlab: 20 passed. submit_all.sh dry-submit with a fake sbatch produced six job ids and required local submission artifacts without launching real Slurm jobs."
  },
  "critic": {
    "verdict": "Local implementation and route-contract checks pass after aligning submit_all.sh with the attached entrypoint contract. External review prompt has been prepared for stricter line-by-line audit.",
    "report_path": "docs/experiments/DUCA_UNIFIED_FULLMATRIX_EXTERNAL_REVIEW_PROMPT.md"
  },
  "evaluator": {
    "verdict": "Remote evaluator has not run because no real Slurm deployment has been executed in this local turn. Aggregation and bootstrap tools remain fail-closed until completed result files exist.",
    "report_path": "scripts/duca_unified_fullmatrix/matrix.json"
  },
  "run_root": "/data/run01/sczc063/yuzibo/experiments/duca_unified_fullmatrix_90b81a6b0938_<timestamp>",
  "slurm": {
    "preflight_job_id": null,
    "train_eval_array_job_id": null,
    "cost_array_job_id": null,
    "bootstrap_array_job_id": null,
    "finalizer_job_id": null,
    "audit_afterany_job_id": null,
    "submission_argv": "FINAL_SHA=90b81a6b09388b11e67c9d62a070a9285b4cc3b7\nbash scripts/duca_unified_fullmatrix/submit_all.sh \\\n  --repo-root \"/data/run01/sczc063/yuzibo/projects/opentad_duca_unified_90b81a6b0938\" \\\n  --revision \"$FINAL_SHA\" \\\n  --run-root \"/data/run01/sczc063/yuzibo/experiments/duca_unified_fullmatrix_90b81a6b0938_$(date +%Y%m%d_%H%M%S)\" \\\n  --base \"/data/run01/sczc063/yuzibo\" \\\n  --account sczc063 \\\n  --partition gpu \\\n  --qos normal \\\n  --max-concurrent \"${DUCA_MATRIX_MAX_CONCURRENT:-8}\""
  },
  "artifacts": [
    "docs/experiments/DUCA_UNIFIED_FULLMATRIX_GITHUB_MATRIX_RECORD.md",
    "docs/experiments/DUCA_UNIFIED_FULLMATRIX_EXTERNAL_REVIEW_PROMPT.md",
    "docs/experiments/DUCA_UNIFIED_FULLMATRIX_LOCAL_IMPLEMENTATION_REPORT.json",
    "docs/experiments/duca_unified_matrix_manifest.yaml",
    "scripts/duca_unified_fullmatrix/matrix.tsv",
    "scripts/duca_unified_fullmatrix/matrix.json",
    "scripts/duca_unified_fullmatrix/submit_all.sh",
    "configs/adatad/thumos/duca_unified_fullmatrix/",
    "https://github.com/yuzbo/OpenTAD_C3_CoarseClean_20260702/tree/codex/duca-unified-fullmatrix-20260902",
    "https://github.com/yuzbo/OpenTAD_C3_CoarseClean_20260702/commit/90b81a6b09388b11e67c9d62a070a9285b4cc3b7"
  ],
  "blockers": [
    "No real remote Slurm job IDs exist yet; GitHub push and local documentation are separate from N16R4 train/eval deployment.",
    "Empirical THUMOS14 metrics, cost measurements, and bootstrap statistics cannot be claimed before the Slurm DAG finishes and aggregation/bootstrap artifacts pass."
  ],
  "claim_boundary": "This record covers implementation, GitHub preparation, matrix documentation, and local verification only. It makes no mAP, cost, latency, bootstrap, or A11-A10 success claim."
}
